{
  "schema_version": "2.0.0",
  "id": "TEST-1",
  "revision": "r1",
  "task_id": "TASK-FIXTURE",
  "stage": "TEST",
  "synthetic": true,
  "status": {
    "artifact": "BASELINED",
    "execution": "SUCCEEDED",
    "verification": "VERIFIED",
    "approval": "APPROVED"
  },
  "input_refs": [
    {
      "id": "SOURCE-POLICY",
      "revision": "r1",
      "location": "sources/policy.json"
    },
    {
      "id": "REQ-1",
      "revision": "r1",
      "location": "ledger.json"
    }
  ],
  "approval": {
    "id": "APPROVAL-TEST",
    "revision": "r1",
    "status": "APPROVED",
    "authority": "fixture-owner",
    "policy": {
      "id": "SOURCE-POLICY",
      "revision": "r1",
      "location": "sources/policy.json"
    },
    "scope": [
      "isolated arithmetic fixture"
    ],
    "artifact_refs": [
      {
        "id": "SOURCE-CANDIDATE",
        "revision": "r1",
        "location": "sources/candidate.json"
      }
    ],
    "expires_at": "NONE",
    "evidence_ids": [
      "E-APPROVAL"
    ],
    "actions": [
      "draft",
      "execute",
      "accept",
      "handoff"
    ],
    "target_refs": [
      {
        "id": "SOURCE-CANDIDATE",
        "revision": "r1",
        "location": "sources/candidate.json"
      }
    ],
    "configuration_refs": []
  },
  "evidence": [
    {
      "id": "E-SOURCE",
      "claim_class": "VERIFIED_FACT",
      "kind": "SOURCE",
      "source": {
        "id": "SOURCE-POLICY",
        "revision": "r1",
        "location": "sources/policy.json"
      },
      "observed_at": "2026-10-16T07:00:00+00:00",
      "observer": "synthetic-fixture-author",
      "method": "deterministic synthetic record construction",
      "execution": "SUCCEEDED",
      "result": "PASS",
      "limitations": [
        "Synthetic data, not observed behavioral or product evidence"
      ],
      "classification": "public synthetic",
      "retention_policy": "retain fixture version"
    },
    {
      "id": "E-APPROVAL",
      "claim_class": "VERIFIED_FACT",
      "kind": "APPROVAL",
      "source": {
        "id": "SOURCE-POLICY",
        "revision": "r1",
        "location": "sources/policy.json"
      },
      "observed_at": "2026-10-16T07:00:00+00:00",
      "observer": "synthetic-fixture-author",
      "method": "deterministic synthetic record construction",
      "execution": "SUCCEEDED",
      "result": "PASS",
      "limitations": [
        "Synthetic data, not observed behavioral or product evidence"
      ],
      "classification": "public synthetic",
      "retention_policy": "retain fixture version"
    },
    {
      "id": "E-EXECUTION",
      "claim_class": "VERIFIED_FACT",
      "kind": "COMMAND",
      "source": {
        "id": "SOURCE-RECEIPT",
        "revision": "r1",
        "location": "sources/receipt.json"
      },
      "observed_at": "2026-10-16T07:00:00+00:00",
      "observer": "synthetic-fixture-author",
      "method": "deterministic synthetic record construction",
      "execution": "SUCCEEDED",
      "result": "PASS",
      "limitations": [
        "Synthetic data, not observed behavioral or product evidence"
      ],
      "classification": "public synthetic",
      "retention_policy": "retain fixture version"
    },
    {
      "id": "E-TEST",
      "claim_class": "VERIFIED_FACT",
      "kind": "TEST",
      "source": {
        "id": "SOURCE-RECEIPT",
        "revision": "r1",
        "location": "sources/receipt.json"
      },
      "observed_at": "2026-10-16T07:00:00+00:00",
      "observer": "synthetic-fixture-author",
      "method": "deterministic synthetic record construction",
      "execution": "SUCCEEDED",
      "result": "PASS",
      "limitations": [
        "Synthetic data, not observed behavioral or product evidence"
      ],
      "classification": "public synthetic",
      "retention_policy": "retain fixture version"
    }
  ],
  "controls": [
    {
      "id": "CTRL-1",
      "authority_type": "ORGANIZATIONAL",
      "authority": {
        "id": "SOURCE-POLICY",
        "revision": "r1",
        "location": "sources/policy.json"
      },
      "applicability": "APPLICABLE",
      "owner": "fixture-owner",
      "enforcement": "synthetic fixture boundary; not installed host enforcement",
      "coverage": [
        "fixture operations"
      ],
      "bypass_paths": [
        "No real external enforcement claimed"
      ],
      "timeout": "one fixture step",
      "error_policy": "block",
      "proof_ids": [
        "E-SOURCE"
      ]
    }
  ],
  "decisions": [
    {
      "id": "ADR-1",
      "revision": "r1",
      "question": "How to implement fixture addition?",
      "alternatives": [
        "direct addition",
        "loop increments"
      ],
      "selection": "direct addition",
      "rationale": "Exact operation; no loop cost or behavior ambiguity",
      "authority": "fixture-owner",
      "evidence_ids": [
        "E-SOURCE"
      ]
    }
  ],
  "unresolved": [],
  "gates": [
    {
      "id": "TEST-ENTRY",
      "action": "execute",
      "outcome": "PASS",
      "criteria": [
        "Apply the documented TEST-ENTRY criterion to the active task"
      ],
      "input_refs": [
        {
          "id": "SOURCE-POLICY",
          "revision": "r1",
          "location": "sources/policy.json"
        }
      ],
      "control_ids": [
        "CTRL-1"
      ],
      "evidence_ids": [
        "E-SOURCE"
      ],
      "owner": "fixture-owner",
      "rationale": "Supported synthetic consistency fixture",
      "applicability_authority": "fixture-owner"
    },
    {
      "id": "TEST-ORACLE",
      "action": "accept",
      "outcome": "PASS",
      "criteria": [
        "Apply the documented TEST-ORACLE criterion to the active task"
      ],
      "input_refs": [
        {
          "id": "SOURCE-POLICY",
          "revision": "r1",
          "location": "sources/policy.json"
        }
      ],
      "control_ids": [
        "CTRL-1"
      ],
      "evidence_ids": [
        "E-SOURCE"
      ],
      "owner": "fixture-owner",
      "rationale": "Supported synthetic consistency fixture",
      "applicability_authority": "fixture-owner"
    },
    {
      "id": "TEST-EXIT",
      "action": "accept",
      "outcome": "PASS",
      "criteria": [
        "Apply the documented TEST-EXIT criterion to the active task"
      ],
      "input_refs": [
        {
          "id": "SOURCE-POLICY",
          "revision": "r1",
          "location": "sources/policy.json"
        }
      ],
      "control_ids": [
        "CTRL-1"
      ],
      "evidence_ids": [
        "E-SOURCE"
      ],
      "owner": "fixture-owner",
      "rationale": "Supported synthetic consistency fixture",
      "applicability_authority": "fixture-owner"
    }
  ],
  "trace": [
    {
      "from": {
        "id": "REQ-1",
        "revision": "r1",
        "location": "ledger.json"
      },
      "to": {
        "id": "TEST-1",
        "revision": "r1",
        "location": "test.json"
      },
      "relation": "SATISFIES",
      "evidence_ids": [
        "E-SOURCE"
      ],
      "state": "CURRENT",
      "reason": "Synthetic arithmetic fixture mapping"
    }
  ],
  "history": [],
  "data": {
    "candidate": {
      "id": "SOURCE-CANDIDATE",
      "revision": "r1",
      "location": "sources/candidate.json"
    },
    "environment": {
      "id": "SOURCE-ENVIRONMENT",
      "revision": "r1",
      "location": "sources/environment.json"
    },
    "acceptance_policy": {
      "id": "SOURCE-POLICY",
      "revision": "r1",
      "location": "sources/policy.json"
    },
    "test_matrix": [
      {
        "id": "TEST-TEST_MATRIX-1",
        "revision": "r1",
        "claim_class": "VERIFIED_FACT",
        "summary": "Synthetic test matrix for arithmetic fixture",
        "owner": "fixture-owner",
        "evidence_ids": [
          "E-SOURCE"
        ],
        "requirement_ids": [
          "REQ-1"
        ],
        "details": {
          "synthetic": true,
          "scope": "isolated arithmetic only",
          "criterion": "add(2,3)=5",
          "alternatives": [
            "direct addition",
            "loop increments"
          ],
          "failure_behavior": "raise for unsupported operands",
          "window": "one deterministic observation",
          "independence": "owner supplied arithmetic example",
          "compatibility": "no persistent schema",
          "recovery": "restore pinned fixture snapshot",
          "receiver": "fixture-owner",
          "accepted": true
        }
      }
    ],
    "exclusions": [],
    "oracles": [
      {
        "id": "TEST-ORACLES-1",
        "revision": "r1",
        "claim_class": "VERIFIED_FACT",
        "summary": "Synthetic oracles for arithmetic fixture",
        "owner": "fixture-owner",
        "evidence_ids": [
          "E-SOURCE"
        ],
        "requirement_ids": [
          "REQ-1"
        ],
        "details": {
          "synthetic": true,
          "scope": "isolated arithmetic only",
          "criterion": "add(2,3)=5",
          "alternatives": [
            "direct addition",
            "loop increments"
          ],
          "failure_behavior": "raise for unsupported operands",
          "window": "one deterministic observation",
          "independence": "owner supplied arithmetic example",
          "compatibility": "no persistent schema",
          "recovery": "restore pinned fixture snapshot",
          "receiver": "fixture-owner",
          "accepted": true
        }
      }
    ],
    "test_data": [
      {
        "id": "TEST-TEST_DATA-1",
        "revision": "r1",
        "claim_class": "VERIFIED_FACT",
        "summary": "Synthetic test data for arithmetic fixture",
        "owner": "fixture-owner",
        "evidence_ids": [
          "E-SOURCE"
        ],
        "requirement_ids": [
          "REQ-1"
        ],
        "details": {
          "synthetic": true,
          "scope": "isolated arithmetic only",
          "criterion": "add(2,3)=5",
          "alternatives": [